{
  "id": "esc_culture_media",
  "name": "Mouse ESC Medium",
  "nameCn": "小鼠 ES 细胞培养基",
  "category": "media",
  "tags": [
    "ESC",
    "stem cell",
    "LIF",
    "pluripotent"
  ],
  "components": [
    {
      "name": "DMEM high glucose",
      "amount": 414.45,
      "unit": "mL",
      "note": {
        "en": "Bring to 500 mL final volume",
        "zh": "定容至 500 mL"
      }
    },
    {
      "name": "ESC-qualified FBS",
      "amount": 75,
      "unit": "mL",
      "note": "15% final"
    },
    {
      "name": "100× NEAA",
      "amount": 5,
      "unit": "mL"
    },
    {
      "name": "100× L-Glutamine",
      "amount": 5,
      "unit": "mL"
    },
    {
      "name": "1000× β-ME (55 mM)",
      "amount": 0.5,
      "unit": "mL",
      "note": "0.1 mM final"
    },
    {
      "name": "LIF (10⁶ U/mL)",
      "amount": 0.05,
      "unit": "mL",
      "note": "1000 U/mL final"
    }
  ],
  "notes": {
    "en": "LIF maintains pluripotency — add fresh. For feeder-free: gelatin + 2i (PD0325901 + CHIR99021) + LIF. Compact domed colonies = pluripotent.",
    "zh": "LIF 维持多能性——需新鲜加入。无饲养层培养：明胶 + 2i (PD0325901 + CHIR99021) + LIF。致密圆顶样克隆 = 多能。"
  },
  "ref": "Smith et al. (1988) Nature 336:688",
  "source": "Nature",
  "discipline": [
    "cell"
  ],
  "storage": {
    "temperature": "4°C",
    "duration": "2 weeks",
    "sterile": "filter_022",
    "notes": "Add LIF fresh; keep cold"
  },
  "usage": {
    "en": "Embryonic stem cell (ESC) serum-containing LIF culture medium for pluripotency maintenance.",
    "zh": "含 LIF 的胚胎干细胞培养基，用于维持多能性。"
  },
  "volume": 500,
  "volumeUnit": "mL",
  "prepSteps": [
    {
      "step": "To 500 mL Knockout DMEM (or DMEM/F12), add 75 mL Knockout Serum Replacement (15%)."
    },
    {
      "step": "Add 5 mL non-essential amino acids (1×)."
    },
    {
      "step": "Add 5 mL L-glutamine (2 mM) and 0.5 mL β-mercaptoethanol (0.1 mM)."
    },
    {
      "step": "Add LIF (1000 U/mL) for mouse ESCs or bFGF (10 ng/mL) for human ESCs."
    },
    {
      "step": "Filter-sterilize if adding non-sterile components."
    },
    {
      "step": "Store at 4°C for up to 2 weeks; add LIF/bFGF fresh."
    }
  ],
  "crosslinks": [
    "cell_passage",
    "cell_freezing"
  ]
}
