{
  "id": "alizarin_red",
  "name": "Alizarin Red S (Osteogenic)",
  "nameCn": "茜素红 S 钙化染色",
  "category": "staining",
  "tags": [
    "staining",
    "calcium",
    "osteogenic"
  ],
  "components": [
    {
      "name": "Alizarin Red S",
      "amount": 2,
      "unit": "g",
      "mw": 342.26
    },
    {
      "name": "ddH₂O to 100 mL, pH 4.1-4.3",
      "amount": null,
      "unit": "mL"
    }
  ],
  "notes": {
    "en": "Detects calcium deposits. Fix cells 4% PFA, stain 20 min RT. Quantify with cetylpyridinium chloride, OD562.",
    "zh": "检测钙沉积。4% PFA 固定，室温染色 20 min。十六烷基氯化吡啶提取，OD562 定量。"
  },
  "ref": "Gregory et al. (2004) Anal Biochem 329:77",
  "source": "Analytical Biochemistry",
  "discipline": [
    "general"
  ],
  "storage": {
    "temperature": "RT",
    "duration": "6 months",
    "sterile": "not_required",
    "notes": "Light-sensitive"
  },
  "usage": {
    "en": "Alizarin Red S stain for detecting calcium deposits in osteogenic differentiation assays.",
    "zh": "茜素红 S 染色，用于检测成骨分化实验中的钙沉积。"
  },
  "volume": 500,
  "volumeUnit": "mL",
  "prepSteps": [
    {
      "step": "Dissolve Alizarin Red S (2 g per 100 mL, 2% w/v) in ddH₂O."
    },
    {
      "step": "Adjust pH to 4.1–4.3 with ammonium hydroxide (10%) or HCl."
    },
    {
      "step": "Filter through 0.45 µm."
    },
    {
      "step": "Store at room temperature protected from light for up to 6 months."
    }
  ],
  "crosslinks": [
    "clonogenic_assay"
  ]
}
