{
  "id": "ponceau_s",
  "name": "Ponceau S Staining Solution",
  "category": "staining",
  "tags": [
    "WB",
    "transfer verification"
  ],
  "components": [
    {
      "name": "Ponceau S",
      "amount": 0.1,
      "unit": "g",
      "note": {
        "en": "0.1% (w/v)",
        "zh": "0.1% (w/v)"
      }
    },
    {
      "name": "Acetic acid",
      "amount": 5,
      "unit": "mL",
      "note": {
        "en": "5% (v/v)",
        "zh": "5% (v/v)"
      }
    },
    {
      "name": "ddH₂O",
      "amount": 95,
      "unit": "mL"
    }
  ],
  "nameCn": "Ponceau S 染色液",
  "notes": {
    "en": "Soak PVDF/NC membrane for 1–5 min after transfer. Rinse with TBS or water to destain. Solution is reusable.",
    "zh": "转膜后浸泡 PVDF/NC 膜 1–5 min，TBS 或水洗即可脱色。可重复使用。"
  },
  "ref": "Romero-Calvo et al. (2010) Anal Biochem 401:318–320",
  "discipline": [
    "general"
  ],
  "storage": {
    "temperature": "RT",
    "duration": "12 months",
    "sterile": "not_required",
    "notes": "Reuse 2-3 times; discard if faded"
  },
  "usage": {
    "en": "Reversible red protein stain for verifying transfer efficiency on western blot membranes.",
    "zh": "可逆红色蛋白染色，用于验证 Western blot 转膜效率。"
  },
  "volume": 1000,
  "volumeUnit": "mL",
  "prepSteps": [
    {
      "step": "Dissolve Ponceau S (0.1–0.2% w/v) in 5% acetic acid."
    },
    {
      "step": "Mix until completely dissolved."
    },
    {
      "step": "Store at room temperature."
    },
    {
      "step": "Solution can be reused many times; filter if precipitate forms."
    }
  ],
  "crosslinks": [
    "wb_protocol"
  ]
}
